{
  "$schema": "../../../schemas/v1/historical-regression-fixture.schema.json",
  "schema_version": 1,
  "id": "th105-reimu-owned-extents",
  "title": "Physical ownership and exactness are separate claims",
  "project": "th105",
  "contract": "owned-extent-exactness",
  "provenance": {
    "repository": "N0zoM1z0/th105",
    "commit": "07f5ac9f35c041858962acc35e941ef9379451a5",
    "paths": [
      "config/function-byte-ownership.toml",
      "config/functions.csv",
      "docs/RE_HANDOFF.md"
    ],
    "observation": "ReimuObject vslot +0x28 owns 39,846 instruction bytes in its provisional main span and a 6,282-byte remote chunk, but the source is absent and neither lane is exact."
  },
  "input": {
    "main_size": 39853,
    "main_exclusions": [
      {
        "start": "0x0049D169",
        "end": "0x0049D16F",
        "size": 7,
        "sha256": "4fe06c07aad18cb5faea1a925ff71a52931084bbb3f844ffd60bae6a9ce14cce"
      }
    ],
    "remote_chunks": [
      {
        "start": "0x004A00F0",
        "end": "0x004A1979",
        "size": 6282,
        "sha256": "b523e6ad1a2344a1576ded336b4306475d8dc27957b970fe58f559a2d418db88"
      }
    ],
    "declared_main_excluded_bytes": 7,
    "declared_remote_bytes": 6282,
    "declared_owned_bytes": 46128,
    "main_exact": false,
    "remote_exact": false,
    "declared_exact_bytes": 0,
    "require_complete_exact": true
  },
  "expected": {
    "verdict": "incomplete",
    "diagnostics": [
      "main-extent-exactness-unknown",
      "remote-extent-exactness-unknown"
    ]
  }
}
