{
  "$schema": "../../../schemas/v1/historical-regression-fixture.schema.json",
  "schema_version": 1,
  "id": "th08-relocation-literal-content",
  "title": "A matching relocation edge does not prove destination data equality",
  "project": "th08",
  "contract": "relocation-destination-content",
  "provenance": {
    "repository": "N0zoM1z0/th08",
    "commit": "7148a76ba224742677895c7160807a68897957d5",
    "paths": [
      "config/match-units.toml",
      "docs/RE_HANDOFF.md",
      "scripts/match_literals.py",
      "src/ItemManager.cpp"
    ],
    "observation": "ItemManager::OnUpdate had the right DIR32 destination edge at 0x004B5B30 but source encoded double 0.0 while the target destination contains double 128.0."
  },
  "input": {
    "relocation_type": "DIR32",
    "required_relocation_type": "DIR32",
    "addend": 0,
    "required_addend": 0,
    "candidate_symbol": "__real@0000000000000000",
    "candidate_destination": "0x004B5B30",
    "target_destination": "0x004B5B30",
    "candidate_data_hex": "0000000000000000",
    "target_data_hex": "0000000000006040"
  },
  "expected": {
    "verdict": "fail",
    "diagnostics": ["relocation-destination-content-mismatch"]
  }
}
